{
  "version": "2.1",
  "status": "ACTIVE",
  "description": "Derived outcome-to-product relationships generated from products' mechanism profiles (product-mechanisms.json) matched against each outcome's candidateMechanisms (outcomes.json). This file is DERIVED, not hand-curated: it must be regenerated whenever product-mechanisms.json or outcomes.json change. Score is contribution-weighted (sum of matched mechanisms' strength/5 x confidence, each mechanism discarded below a 0.5 contribution threshold), not a coverage ratio, so outcomes with long candidate-mechanism lists are not structurally penalised relative to outcomes with short ones. 'coverage' (matched/required) is retained as an informational field only and does not drive ranking or evidenceScore. evidenceScore normalises the raw contribution score to 0-100 against the top-scoring product for that specific outcome; scores are only ever comparable within one outcome's list, never across outcomes.",
  "generationRule": "sum(strength/5 x confidence) over each product's mechanisms that are also in the outcome's candidateMechanisms, discarding any single mechanism contribution below 0.5, then normalised 0-100 against the top product for that outcome.",
  "outcomeCount": 9,
  "productOutcomeRelationshipCount": 115,
  "outcomes": [
    {
      "outcomeId": "OUT001",
      "outcome": "Better Sleep",
      "productCount": 10,
      "products": [
        {
          "id": "PRD020",
          "name": "Synergy SleepWell",
          "matchedMechanisms": [
            "MEC057",
            "MEC058"
          ],
          "matchedMechanismCount": 2,
          "requiredMechanismCount": 2,
          "coverage": 1.0,
          "averageStrength": 3.5,
          "evidenceScore": 100.0
        },
        {
          "id": "PRD001",
          "name": "Synergy ProArgi-9+",
          "matchedMechanisms": [
            "MEC057"
          ],
          "matchedMechanismCount": 1,
          "requiredMechanismCount": 2,
          "coverage": 0.5,
          "averageStrength": 5.0,
          "evidenceScore": 78.0
        },
        {
          "id": "PRD002",
          "name": "Synergy e9",
          "matchedMechanisms": [
            "MEC057"
          ],
          "matchedMechanismCount": 1,
          "requiredMechanismCount": 2,
          "coverage": 0.5,
          "averageStrength": 5.0,
          "evidenceScore": 78.0
        },
        {
          "id": "PRD004",
          "name": "Synergy Pro360 Wholefood Greens",
          "matchedMechanisms": [
            "MEC057"
          ],
          "matchedMechanismCount": 1,
          "requiredMechanismCount": 2,
          "coverage": 0.5,
          "averageStrength": 5.0,
          "evidenceScore": 78.0
        },
        {
          "id": "PRD005",
          "name": "Synergy Pro360 Superfood Performance Beets",
          "matchedMechanisms": [
            "MEC057"
          ],
          "matchedMechanismCount": 1,
          "requiredMechanismCount": 2,
          "coverage": 0.5,
          "averageStrength": 5.0,
          "evidenceScore": 78.0
        },
        {
          "id": "PRD008",
          "name": "Synergy Biome Shake",
          "matchedMechanisms": [
            "MEC057"
          ],
          "matchedMechanismCount": 1,
          "requiredMechanismCount": 2,
          "coverage": 0.5,
          "averageStrength": 5.0,
          "evidenceScore": 78.0
        },
        {
          "id": "PRD016",
          "name": "Synergy Omega-3",
          "matchedMechanisms": [
            "MEC057"
          ],
          "matchedMechanismCount": 1,
          "requiredMechanismCount": 2,
          "coverage": 0.5,
          "averageStrength": 5.0,
          "evidenceScore": 78.0
        },
        {
          "id": "PRD021",
          "name": "Synergy Multivitamin",
          "matchedMechanisms": [
            "MEC057"
          ],
          "matchedMechanismCount": 1,
          "requiredMechanismCount": 2,
          "coverage": 0.5,
          "averageStrength": 5.0,
          "evidenceScore": 78.0
        },
        {
          "id": "PRD003",
          "name": "Synergy Immune Booster",
          "matchedMechanisms": [
            "MEC057"
          ],
          "matchedMechanismCount": 1,
          "requiredMechanismCount": 2,
          "coverage": 0.5,
          "averageStrength": 4.0,
          "evidenceScore": 62.4
        },
        {
          "id": "PRD011",
          "name": "Mistify",
          "matchedMechanisms": [
            "MEC057"
          ],
          "matchedMechanismCount": 1,
          "requiredMechanismCount": 2,
          "coverage": 0.5,
          "averageStrength": 4.0,
          "evidenceScore": 62.4
        }
      ]
    },
    {
      "outcomeId": "OUT002",
      "outcome": "More Energy",
      "productCount": 12,
      "products": [
        {
          "id": "PRD004",
          "name": "Synergy Pro360 Wholefood Greens",
          "matchedMechanisms": [
            "MEC044",
            "MEC102"
          ],
          "matchedMechanismCount": 2,
          "requiredMechanismCount": 2,
          "coverage": 1.0,
          "averageStrength": 5.0,
          "evidenceScore": 100.0
        },
        {
          "id": "PRD021",
          "name": "Synergy Multivitamin",
          "matchedMechanisms": [
            "MEC044",
            "MEC102"
          ],
          "matchedMechanismCount": 2,
          "requiredMechanismCount": 2,
          "coverage": 1.0,
          "averageStrength": 5.0,
          "evidenceScore": 100.0
        },
        {
          "id": "PRD008",
          "name": "Synergy Biome Shake",
          "matchedMechanisms": [
            "MEC102",
            "MEC044"
          ],
          "matchedMechanismCount": 2,
          "requiredMechanismCount": 2,
          "coverage": 1.0,
          "averageStrength": 5.0,
          "evidenceScore": 92.5
        },
        {
          "id": "PRD001",
          "name": "Synergy ProArgi-9+",
          "matchedMechanisms": [
            "MEC044",
            "MEC102"
          ],
          "matchedMechanismCount": 2,
          "requiredMechanismCount": 2,
          "coverage": 1.0,
          "averageStrength": 4.5,
          "evidenceScore": 79.1
        },
        {
          "id": "PRD007",
          "name": "Synergy Biome DT",
          "matchedMechanisms": [
            "MEC102",
            "MEC044"
          ],
          "matchedMechanismCount": 2,
          "requiredMechanismCount": 2,
          "coverage": 1.0,
          "averageStrength": 4.0,
          "evidenceScore": 70.6
        },
        {
          "id": "PRD013",
          "name": "Synergy Collagen+ Beauty",
          "matchedMechanisms": [
            "MEC044"
          ],
          "matchedMechanismCount": 1,
          "requiredMechanismCount": 2,
          "coverage": 0.5,
          "averageStrength": 5.0,
          "evidenceScore": 50.0
        },
        {
          "id": "PRD016",
          "name": "Synergy Omega-3",
          "matchedMechanisms": [
            "MEC044"
          ],
          "matchedMechanismCount": 1,
          "requiredMechanismCount": 2,
          "coverage": 0.5,
          "averageStrength": 5.0,
          "evidenceScore": 50.0
        },
        {
          "id": "PRD005",
          "name": "Synergy Pro360 Superfood Performance Beets",
          "matchedMechanisms": [
            "MEC044"
          ],
          "matchedMechanismCount": 1,
          "requiredMechanismCount": 2,
          "coverage": 0.5,
          "averageStrength": 5.0,
          "evidenceScore": 42.5
        },
        {
          "id": "PRD011",
          "name": "Mistify",
          "matchedMechanisms": [
            "MEC044"
          ],
          "matchedMechanismCount": 1,
          "requiredMechanismCount": 2,
          "coverage": 0.5,
          "averageStrength": 5.0,
          "evidenceScore": 42.5
        },
        {
          "id": "PRD018",
          "name": "Synergy Liver Health",
          "matchedMechanisms": [
            "MEC044"
          ],
          "matchedMechanismCount": 1,
          "requiredMechanismCount": 2,
          "coverage": 0.5,
          "averageStrength": 5.0,
          "evidenceScore": 42.5
        },
        {
          "id": "PRD002",
          "name": "Synergy e9",
          "matchedMechanisms": [
            "MEC044"
          ],
          "matchedMechanismCount": 1,
          "requiredMechanismCount": 2,
          "coverage": 0.5,
          "averageStrength": 4.0,
          "evidenceScore": 40.0
        },
        {
          "id": "PRD014",
          "name": "Synergy FL-3X",
          "matchedMechanisms": [
            "MEC044"
          ],
          "matchedMechanismCount": 1,
          "requiredMechanismCount": 2,
          "coverage": 0.5,
          "averageStrength": 4.0,
          "evidenceScore": 34.0
        }
      ]
    },
    {
      "outcomeId": "OUT003",
      "outcome": "Healthy Weight Management",
      "productCount": 18,
      "products": [
        {
          "id": "PRD004",
          "name": "Synergy Pro360 Wholefood Greens",
          "matchedMechanisms": [
            "MEC040",
            "MEC041",
            "MEC044",
            "MEC043"
          ],
          "matchedMechanismCount": 4,
          "requiredMechanismCount": 4,
          "coverage": 1.0,
          "averageStrength": 4.75,
          "evidenceScore": 100.0
        },
        {
          "id": "PRD013",
          "name": "Synergy Collagen+ Beauty",
          "matchedMechanisms": [
            "MEC040",
            "MEC044",
            "MEC043",
            "MEC041"
          ],
          "matchedMechanismCount": 4,
          "requiredMechanismCount": 4,
          "coverage": 1.0,
          "averageStrength": 4.75,
          "evidenceScore": 100.0
        },
        {
          "id": "PRD011",
          "name": "Mistify",
          "matchedMechanisms": [
            "MEC040",
            "MEC041",
            "MEC044",
            "MEC043"
          ],